{
  "schema_version": 1,
  "generated_at": "2026-08-11T17:30:00Z",
  "scan_error": "context deadline exceeded",
  "fleet": {
    "sessions": 2,
    "live": 1,
    "idle": 1,
    "stale": 0,
    "unknown": 0,
    "vendors_watching": 0,
    "vendors_not_detected": 0,
    "vendors_unreadable": 0,
    "vendors_drifted": 1,
    "context_pct_max": 20,
    "cost_usd_total": null,
    "last_activity": "2026-08-11T17:29:55Z"
  },
  "vendors": [
    {
      "vendor": "claude",
      "status": "drifted",
      "error": null,
      "sessions": 2,
      "live": 1,
      "drifted": 1,
      "context_pct_max": 20,
      "cost_usd_total": null,
      "subagents_max": null,
      "last_activity": "2026-08-11T17:29:55Z",
      "quota": [],
      "quota_read_at": null,
      "estimated": [
        "context_pct"
      ],
      "unsupported": [],
      "self_reported": false
    }
  ]
}
